index,name,address,description,latitude,longitude,level
0,희방폭포,경상북도 영주시 풍기읍 죽령로1720번길 278 (희방사쪽),"영남 지방 최대의 폭포로, 영남 제 1의 폭포로 일컬어지기도 한다.",36.9179661,128.4578264,3
1,영주 무섬마을,경상북도 영주시 문수면 무섬로234번길,"물 위에 떠 있는 섬을 뜻하는 수도리(水島里)의 우리말 이름으로 삼면이 내성천과 접해있는 전형적인 물도리 마을로 마을 앞을 돌아나가는 내성천은 맑고 잔잔하며 산과 물이 태극 모양으로 서로 안고 휘감아 돌아 산수의 경치가 절경을 이룬다.",36.73075295,128.62334528724995,3
4,희방사,경상북도 영주시 풍기읍 수철리 산1-1,"소백산에 위치한 사찰로 등산코스로 유명하다.",36.9198359,128.4571206,3
5,선비촌,경상북도 영주시 순흥면 청구리 357,"조선시대의 전통가옥을 복원하고 생활상을 재현하여, 유교문화를 직접 체험하고 학습할 수 있도록 영주시에서 지은 테마파크이다.",36.927054,128.579676,3
8,초암사,경상북도 영주시 순흥면 배점리 524,",",36.944543,128.525867,3
10,비로사,경상북도 영주시 풍기읍 삼가리 381,",",36.93887,128.498949,3
11,소수박물관,경상북도 영주시 풍기읍 삼가리 381,",",36.92577180000001,128.58207977272318,3
13,풍기인삼시장,경상북도 영주시 풍기읍 서부리 145-3 KR,",",36.873074,128.524046,3
