index,name,address,description,latitude,longitude,level
0,고창읍성,전라북도 고창군 고창읍 모양성로 1,"자연석으로 만든 성곽으로 모양석이라 부른다",35.4296505,126.70497657737846,3
1,무장읍성,전라북도 고창군 무장면 성내리 149-1,"1417년 무장진의 병마사에 마을을 다스리는 기능을 주어 무장진 병마사 김노(金蘆)가 쌓은 길이 약 1.2km의 평지성이다.",35.4182676,126.55719533708904,3
2,선운사(禪雲寺),전라북도 고창군 선운사로 250,서기 577년에 세워진 유명한 불교 사찰로 동백나무가 유명합니다.,0.0,0.0,3
6,고창판소리박물관,전라북도 고창군 고창읍 동리로 100,"고창판소리 박물관은 판소리의 이론가이자 개작자, 후원가였던 동리 신재효 및 진채선, 김소희 등 다수의 명칭을 기념하고 판소리 전통을 계승,발전시키기 위하여 동리 신재효 선생의 고택 자리에 설립되었다.",35.4324669,126.7027193,3
9,고인돌공원,전라북도 고창군 고창읍 고인돌공원길 74,"일대의 고인돌유적지에 조성한 공원으로 2000년 12월 세계문화유산으로 등재된 고창의 고인돌 유적을 보존, 관리하고 관광자원으로 활용하기 위해 만들어졌다",34.77196995,127.70070295839716,3
12,문수사,전라북도 고창군 고수면 은사리 48,"문수산에 있는 삼국시대 신라의 승려 자장이 창건한 사찰",36.778686,126.589605,3
