index,name,address,description,latitude,longitude,level
1,국립익산박물관,전라북도 익산시 금마면 미륵사지로 362,"미륵사지를 비롯하여 익산, 군산지역에서 출토되는 유물을 전시하는 박물관이며, 주로 백제 시대의 유물을 중심으로 전시하고 있다.",36.01082635,127.02748159260103,4
2,웅포관광지,전라북도 익산시 웅포면 웅포리,"웅포관광지 캠핑장은 서해로 흘러가는 넓은 금강 위에 아름다운 해넘이로 유명한 웅포 곰개나루 관광지에 위치한 캠핑장이다.",36.0664182,126.87692237894608,4
3,왕궁리유적,전라북도 익산시 왕궁면 왕궁리 산80-1,"마한의 도읍지설, 백제 무왕의 천도설이나 별도설, 안승의 보덕구설, 후백제 견훤의 도읍설이 전해지는 유적이다.",35.9736104,127.0550154270473,4
5,익산 미륵사지,전라북도 익산시 금마면 기양리 97,7세기에 창건하고 현재 복원해 높이 14m가 넘는 6층 석탑입니다.,36.01224045,127.03055855292592,4
8,수덕호,전라북도 익산시 신동,"원광대학교 정문으로 들어오면 볼 수 있는 관광지로 원광대학교의 자랑이자 볼거리이다.",35.9695728,126.9559798343598,4
9,익산보석박물관,전라북도 익산시 왕궁면 호반로 8,"백제 문화유적과 보석의 아름다움을 관광자원으로 활용하기 위해 14만 1,990㎡ 규모의 왕궁보석 테마관광지내에 건립되었으며, 진귀한 보석 원석 등을 11만여 점 이상 소장하고 있는 세계적 수준의 박물관이다.",35.9907421,127.1022676,4
10,배산체육공원,전라북도 익산시 모현동2가 186-1,"월드컵 규격의 인조 잔디 축구장, 풋살경기장, 테니스장, 족구장, 농구장, 인라인장, 체력단련시설 등이 설치되어 있으며 조명시설이 갖춰져 야간에도 이용이 가능하다.",35.961381700000004,126.94064429101064,4
