index,name,address,description,latitude,longitude,level
0,청풍문화재단지,충청북도 제천시 청풍면 청풍호로 2048,1985년 댐 건설로 수몰된 수 세기 역사 마을의 유물을 이전하여 복원해 놓은 단지입니다.,37.0030997,128.1725002,4
1,의림지,충청북도 제천시 모산동 241,"충청도를 호수의 서쪽이라 하여 호서지방이라고도 부르는데, 여기서 말하는 호수가 바로 의림지를 가리킨다. 그만큼 의림지는 오래되고 유명한 저수지이다. 충청북도 기념물인 의림지는 삼한시대에 축조된 저수지로, 본래 임지라고 했다.",37.17324515,128.21062924206336,4
2,청풍랜드,충청북도 제천시 청풍면 교리,"청풍랜드는 충청북도 제천시 청풍면 일대의 풍광이 뛰어난 청풍호반(일명 충주호)에 독창적이며, 빼어난 풍광과 한정된 공간활용을 극대화하여 국내 최초의 복합 멀티타워를 세웠다.",37.0130823,128.1770225,4
6,청풍호반 케이블카 물태리역,충청북도 제천시 청풍면 문화재길 166,청풍호반케이블카는 하부 승차장인 청풍면 물태리(물태리역)에서 상부 승차장인 비봉산 정상(비봉산역)까지 총 2.3km 구간을 최대 속도 5m/s로 운행하는 최첨단 케이블카 시설이다.,37.00127735,128.16657553664783,4
9,정방사,충청북도 제천시 수산면 능강리 산52,"정방사는 금수산(1,016m) 산자락인 신선봉(845m)에서 청풍방면 도화리로 가지를 뻗어 내린 능선 상에 위치한 사찰이다. 신라 문무왕 2년(662)에 의상대사가 세운 절로, 현재는 속리산 법주사의 말사이며 기도처로 유명하다.",36.99891265,128.20767690452942,4
11,제천중앙시장,충청북도 제천시 교동 용두천로20길 18,"1989년도에 신축된 초현대식 건물로서 제천의 중심부에 위치하고 있고 태백상권의 중심역활을 하고 있고 중앙선, 태백선, 충북선의 철도 분기점이며 중앙고속도로의 개통으로 전국 어디서나 한나절만에 올 수 있는 교통의 중심지이다.",37.13673575,128.21134932841773,4
13,덕주사,충청북도 제천시 한수면 송계리,"대한불교 조계종 제5교구 본사인 법주사(法住寺)의 말사이다. 구전으로 587년(진평왕 9)에 세워졌다고 전해진다. 더불어 신라의 마지막 공주인 덕주공주(德周公主)가 마의태자(麻衣太子) 일행과 이곳에 들렀을 때 이 절을 세워 절 이름을 덕주사라 하고, 골짜기 이름을 덕주골이라고 하였다는 전설도 전해지고 있다.",36.8622411,128.09715885,4
