index,name,address,description,latitude,longitude,level
3,임걸령,전라남도 구례군 토지면 내동리,"지리산국립공원 주능선(노고단~천왕봉)의 노고단(1502m)과 삼도봉(1499m)사이에 있는 고개다.",35.3022055,127.5577023,2
4,천은사,전라남도 구례군 광의면 노고단로 209,"신라 흥덕왕때 덕운선사가 창건, 보물 5점과 도지정문화재 2점이 있다.",37.444506,129.042589,2
6,사성암,전라남도 구례군 문척면 사성암길 303,"정상에서 바라보는 아름다운 구례 전경으로 유명하다. 굽이치며 흐르는 섬진강과 넓은 평야, 그 너머 웅장하게 솟은 지리산의 연봉들을 한눈에 볼 수 있다.",35.1822788,127.4695431,2
8,산수유마을,전라남도 구례군 산동면 계천리 711," 우리나라 최대 산수유 생산지인 이곳은 산수유 꽃망울이 터지기 시작하는 3월 중순부터 4월 초순까지 마을마다 노란 물결로 뒤덮인다.",36.622306,127.632583,2
12,성삼재휴게소,전라남도 구례군 산동면 좌사리,"지리산 등산코스 중 하나의 시작점으로 휴게소까지는 차로 이동할 수 있으며 노고단 정상까지 왕복 2시간 정도면 충분히 다녀올 수 있어 부담이없다.",35.3062606,127.5105708,2
