index,name,address,description,latitude,longitude,level
0,구문소,강원도 태백시 동태백로 11,"카르스트 지형으로 이루어진 이곳은 전기고생대의 지질을 볼 수 있습니다.",37.1000851,129.0222202,2
5,매봉산,강원도 태백시 창죽동 9-385,"매봉산은 고랭지 배추밭과 흰색 풍력발전기가 이국적인 풍광을 연출하는 곳입니다.",37.5447166,127.0089896,2
6,365세이프타운,강원도 태백시 평화길 15 (한국청소년안전체험관),"365세이프타운은 ‘안전 체험 테마파크’으로 이곳에서는 지진, 풍수해, 설해 등을 실제로 체험하며 흥미진진하게 익힐 수 있습니다.",37.1002958,129.024,2
7,태백석탄박물관,강원도 태백시 소도동 천제단길 195,"석탄의 발생과 활용 등을 비롯해 지하갱도 체험을 통해 광산 근로자의 실생활을 간접적으로 체험하고 그 시대를 되새겨볼 수 있습니다.",37.1173761,128.9505567753135,2
11,태백체험공원,강원도 태백시 황지동 38-1,"폐광지라는 지역적 특색을 살려 조성된 체험관광지입니다.",37.1339739,128.97264823329058,2
12,통리탄탄파크,강원도 태백시 통동 산67-1,"최신 IT콘텐츠기술을 접목하여 새롭고 독특한 동굴 디지털콘텐츠를 구현한 테마파크입니다.",37.1609128,129.0435352,2
