index,name,address,description,latitude,longitude,level
0,경포호,강원도 강릉시 저동 94,다양한 철새를 볼 수 있는 호수로 일몰 풍경과 호숫가에 화단이 있는 공원으로 유명합니다.,37.79719165,128.90282284533217,5
1,강릉 선교장,강원도 강릉시 운정동 운정길 63,18세기 상류층 가문의 잘 보존된 우아한 가옥으로 현재는 박물관으로 사용되고 있습니다.,37.785541433179965,128.88485567995704 ,5
2,강릉솔향수목원,강원도 강릉시 구정면 수목원길 156,"솔내음과 꽃향기를 물소리에 실어 마음속으로 전하는 휴식공간입니다.",37.701227,128.866061,5
3,안반데기,강원도 강릉시 왕산면 안반덕길 428,"송글송글 구름도 쉬어가는 마을이라 불리는 해발 1100m의 고산지대의 마을입니다.",37.6155704,128.7663581,5
4,오죽헌,강원도 강릉시 경포동 율곡로3139번길 24,저명한 유학자의 고향이었던 역사적인 장소로 박물관이 있어 다양한 정보를 제공합니다.,37.7789602,128.8773438,5
5,모래시계공원,강원도 강릉시 강동면 헌화로 990-1,"시간의 무한성을 상징하는 둥근 모래시계가 있는 공원입니다.",37.6869353,129.0381580918915,5
