index,name,address,description,latitude,longitude,level
0,대금굴,강원도 삼척시 신기면 환선로 800,암석으로 형성된 거대한 동굴이 있는 자연 관광 명소로 모노레일을 이용할 수 있습니다.,37.3194535,129.0173267,3
1,환선굴(幻仙窟),강원도 삼척시 신기면 환선로 800,종유석과 폭포가 있는 거대한 지하 동굴로 모노레일이 다니고 자유 투어가 가능합니다.,38.51438524983587,128.4175835711135,3
4,삼척해상케이블카 장호역,강원도 삼척시 근덕면 장호항길 12-10 삼척 해상 케이블카 장호 역,"자연절경과 청정해변을 감상할 수 있습니다.",37.2880132,129.31864714448642,3
7,삼척해변역,강원도 삼척시 갈천동 수로부인길 542,해안 철도의 남쪽 종착역으로 모래와 서핑을 즐길 수 있는 삼척해변 근처에 있습니다.,37.468436249099376,129.16640315561722,3
11,죽서루,강원도 삼척시 신기면 대이리 102-3,"절벽 위에 자리한 우리나라의 대표누각입니다.",37.44107985,129.16076593597393,3
13,강원종합박물관,강원도 삼척시 신기면 강원남부로 3016,"20000여점의 세계유물이 전시되어 있는 국내 최대 규모의 종합 박물관입니다.",37.3511951,129.0865739,3
