index,name,address,description,latitude,longitude,level
0,안성맞춤랜드,경기도 안성시 보개면 남사당로 198,"남사당공연장, 천문과학관, 공예문화센터, 안성맞춤캠핑장, 사계절썰매장등의 시설을 운영 중이며 잔디광장, 야생화단지, 수변공원, 분수광장 등을 조성, 예술과 과학, 자연이 만나는 복합 문화예술 공간인 동시에 시민들의 편안한 휴식처입니다.",37.032398,127.31075277552836,5
1,안성맞춤박물관,경기도 안성시 대덕면 서동대로 4726-15,"안성유기, 그리고 안성의 농업 및 향토문화를 소개하고자 건립한 시립박물관입니다.",37.0111431,127.2283965,5
2,안성팜랜드,경기도 안성시 공도읍 웅교리,"농업협동조합에서 직영하는 테마파크이자 체험농장이다. 직접 가축을 만나고 먹이를 주는 체험을 하고있다.",36.9918264,127.1943213,5
7,안성맞춤가족공원,경기도 안성시 공도읍 대림동산길 36,"여러가지 문화 시설을 완비하였으며, 중앙공원에는 분수대와 어린이 놀이터, 농구장, 배구장, 족구장 등의 시설이 갖춰져 있어 가족 단위 휴양지로도 적합하다. ",37.0139374,127.20313492508014,5
13,솔밭공원,경기도 안성시 안성맞춤대로 1143 (금산동),"흑백 자갈, 흑호박돌, 잡석으로 맨발 산책로를 만들어 놓고 그 주변에는 국화를 심어놓아 은은한 꽃 향기를 맡으며 발마사지 할 수 있다.",37.6560698,127.0132485,5
