index,name,address,description,latitude,longitude,level
0,국립과천과학관,경기도 과천시 상하벌로 110,인터랙티브 과학 및 기술 전시관이 있는 현대 박물관으로 천체 투영관과 간이 식당이 있습니다.,37.4384885,127.006147261462,4
1,중앙공원,경기도 과천시 별양동,"관악산, 우면산, 청계산 3개의 산으로 둘러싸여 있는 휴식공간으로 다양한 조각과 넓은 잔디, 놀이터, 운동기구 등을 갖추고 있어 즐거운 시간을 보낼 수 있습니다.",37.3770907,127.1241295028132,4
2,서울랜드,경기도 과천시 광명로 181,올림픽 시즌에 개장되었던 이 가족 명소는 5개의 테마 구역으로 나누어져 있습니다.,37.43382335,127.02024275399924,4
4,국립현대미술관 과천,경기도 과천시 광명로 313,한국과 전 세계 현대 예술가의 작품이 전시된 넓은 미술관과 조각 공원입니다.,37.4294273,127.016266,4
7,추사박물관,경기도 과천시 추사로 78,"추사를 종합적으로 연구, 전시, 체험할 수 있도록 추사의 생애실, 학예실, 후지츠카 기증실, 기획전시실과 체험실, 교육실, 휴게공간, 뮤지엄숍 등을 갖추고 있으며 박물관 야외에는 과지초당이 있다.",37.4526738,127.0287408,4
9,온온사,경기도 과천시 관문동 107-5,"조선 말기의 개화기를 거치면서 대부분 사라져버린 객사 중에서 몇 안 되는 건물 중의 하나이며, 옛 과천현의 중심부를 알려주는 건축물로 주목받고 있다.",37.4360116,126.9938601,4
11,서울대공원,경기도 과천시 대공원광장로 102,"동물원에 약 3,000마리의 동물이 서식하고 있으며 장미 정원, 미술관 및 테마파크를 이용할 수 있습니다.",37.4339353,127.0113836,4
